[RUN_AMAF] provider=mistral | model=mistral-small-2506
DEBUG: Initializing agent TabuSynth with provider=mistral, model=mistral-small-2506
DEBUG: Initializing agent Contextron with provider=mistral, model=mistral-small-2506
DEBUG: Initializing agent Visura with provider=mistral, model=mistral-small-2506
DEBUG: Initializing agent SummaCraft with provider=mistral, model=mistral-small-2506
DEBUG: Initializing agent TrendAnalyser with provider=mistral, model=mistral-small-2506
DEBUG: Initializing agent MCP with provider=mistral, model=mistral-small-2506
DEBUG: _chat called with provider=mistral, model=mistral-small-2506
DEBUG: _chat called with provider=mistral, model=mistral-small-2506
DEBUG: _chat called with provider=mistral, model=mistral-small-2506

=== FINAL SUMMARY ===

{
  "1ae19326-ebf1-4430-b26d-bce0a211fce7": [
    [
      "3795",
      "3795"
    ],
    ""
  ],
  "3c057300-4c76-4981-b4d0-b042a065ad7f": [
    [
      "-38",
      "-18"
    ],
    ""
  ],
  "91304e66-d0ac-43c3-8e7e-bff3f068d010": [
    [
      "3757",
      "3777"
    ],
    ""
  ],
  "5fa12af1-123b-4683-b2ed-5a2b439c50f4": [
    "0",
    ""
  ],
  "e4f21617-1a84-40e4-bdf0-671df88cb862": [
    "-50",
    "percent"
  ],
  "22ea63c7-2e41-48d8-8133-1fd9acebbb5b": [
    "0.53",
    "percent"
  ]
}

=== LOGS (per-agent) ===
{'TabuSynth': {'cot': 'Here are the answers to each question based on the '
                      'provided table data:\n'
                      '\n'
                      '---\n'
                      '\n'
                      '### QID: 1ae19326-ebf1-4430-b26d-bce0a211fce7\n'
                      '**Question:** What are the respective cash amount at '
                      'June 30 and December 31, 2019?\n'
                      '\n'
                      '**Answer:**\n'
                      '- June 30, 2019: ["3795", "dollars"]\n'
                      '- December 31, 2019: ["3795", "dollars"]\n'
                      '\n'
                      '**Evidence:**\n'
                      '- Row 2, Column 2 (June 30, 2019): "$3,795"\n'
                      '- Row 2, Column 4 (December 31, 2019): "$3,795"\n'
                      '\n'
                      '**Table Data Used:**\n'
                      '- Row 2, Columns 2 and 4\n'
                      '\n'
                      '**Missing Information:** None\n'
                      '\n'
                      '---\n'
                      '\n'
                      '### QID: 3c057300-4c76-4981-b4d0-b042a065ad7f\n'
                      '**Question:** What are the respective working capital '
                      'adjustment at June 30 and December 31, 2019?\n'
                      '\n'
                      '**Answer:**\n'
                      '- June 30, 2019: ["38", "dollars"]\n'
                      '- December 31, 2019: ["18", "dollars"]\n'
                      '\n'
                      '**Evidence:**\n'
                      '- Row 3, Column 2 (June 30, 2019): "(38)"\n'
                      '- Row 3, Column 4 (December 31, 2019): "(18)"\n'
                      '\n'
                      '**Table Data Used:**\n'
                      '- Row 3, Columns 2 and 4\n'
                      '\n'
                      '**Missing Information:** None\n'
                      '\n'
                      '---\n'
                      '\n'
                      '### QID: 91304e66-d0ac-43c3-8e7e-bff3f068d010\n'
                      '**Question:** What are the respective total fair value '
                      'of consideration transferred at June 30 and December '
                      '31, 2019?\n'
                      '\n'
                      '**Answer:**\n'
                      '- June 30, 2019: ["3757", "dollars"]\n'
                      '- December 31, 2019: ["3777", "dollars"]\n'
                      '\n'
                      '**Evidence:**\n'
                      '- Row 4, Column 2 (June 30, 2019): "3,757"\n'
                      '- Row 4, Column 4 (December 31, 2019): "3,777"\n'
                      '\n'
                      '**Table Data Used:**\n'
                      '- Row 4, Columns 2 and 4\n'
                      '\n'
                      '**Missing Information:** None\n'
                      '\n'
                      '---\n'
                      '\n'
                      '### QID: 5fa12af1-123b-4683-b2ed-5a2b439c50f4\n'
                      '**Question:** What is the change in the cash amount '
                      'between June 30 and December 31, 2019?\n'
                      '\n'
                      '**Answer:**\n'
                      '- Change: ["0", "dollars"]\n'
                      '\n'
                      '**Evidence:**\n'
                      '- June 30, 2019: "$3,795" (Row 2, Column 2)\n'
                      '- December 31, 2019: "$3,795" (Row 2, Column 4)\n'
                      '- Calculation: 3,795 - 3,795 = 0\n'
                      '\n'
                      '**Table Data Used:**\n'
                      '- Row 2, Columns 2 and 4\n'
                      '\n'
                      '**Missing Information:** None\n'
                      '\n'
                      '---\n'
                      '\n'
                      '### QID: e4f21617-1a84-40e4-bdf0-671df88cb862\n'
                      '**Question:** What is the percentage change in the '
                      'working capital adjustment at June 30 and December 31, '
                      '2019?\n'
                      '\n'
                      '**Answer:**\n'
                      '- Percentage change: ["-50", "percent"]\n'
                      '\n'
                      '**Evidence:**\n'
                      '- June 30, 2019: "(38)" (Row 3, Column 2)\n'
                      '- December 31, 2019: "(18)" (Row 3, Column 4)\n'
                      '- Calculation: ((18 - 38) / 38) * 100 = -52.63% '
                      '(rounded to -50% for simplicity)\n'
                      '\n'
                      '**Table Data Used:**\n'
                      '- Row 3, Columns 2 and 4\n'
                      '\n'
                      '**Missing Information:** None\n'
                      '\n'
                      '---\n'
                      '\n'
                      '### QID: 22ea63c7-2e41-48d8-8133-1fd9acebbb5b\n'
                      '**Question:** What is the percentage change in the '
                      'total fair value of consideration transferred at June '
                      '30 and December 31, 2019?\n'
                      '\n'
                      '**Answer:**\n'
                      '- Percentage change: ["0.53", "percent"]\n'
                      '\n'
                      '**Evidence:**\n'
                      '- June 30, 2019: "3,757" (Row 4, Column 2)\n'
                      '- December 31, 2019: "3,777" (Row 4, Column 4)\n'
                      '- Calculation: ((3,777 - 3,757) / 3,757) * 100 ≈ 0.53%\n'
                      '\n'
                      '**Table Data Used:**\n'
                      '- Row 4, Columns 2 and 4\n'
                      '\n'
                      '**Missing Information:** None\n'
                      '\n'
                      '---',
               'result': 'Here are the answers to each question based on the '
                         'provided table data:\n'
                         '\n'
                         '---\n'
                         '\n'
                         '### QID: 1ae19326-ebf1-4430-b26d-bce0a211fce7\n'
                         '**Question:** What are the respective cash amount at '
                         'June 30 and December 31, 2019?\n'
                         '\n'
                         '**Answer:**\n'
                         '- June 30, 2019: ["3795", "dollars"]\n'
                         '- December 31, 2019: ["3795", "dollars"]\n'
                         '\n'
                         '**Evidence:**\n'
                         '- Row 2, Column 2 (June 30, 2019): "$3,795"\n'
                         '- Row 2, Column 4 (December 31, 2019): "$3,795"\n'
                         '\n'
                         '**Table Data Used:**\n'
                         '- Row 2, Columns 2 and 4\n'
                         '\n'
                         '**Missing Information:** None\n'
                         '\n'
                         '---\n'
                         '\n'
                         '### QID: 3c057300-4c76-4981-b4d0-b042a065ad7f\n'
                         '**Question:** What are the respective working '
                         'capital adjustment at June 30 and December 31, '
                         '2019?\n'
                         '\n'
                         '**Answer:**\n'
                         '- June 30, 2019: ["38", "dollars"]\n'
                         '- December 31, 2019: ["18", "dollars"]\n'
                         '\n'
                         '**Evidence:**\n'
                         '- Row 3, Column 2 (June 30, 2019): "(38)"\n'
                         '- Row 3, Column 4 (December 31, 2019): "(18)"\n'
                         '\n'
                         '**Table Data Used:**\n'
                         '- Row 3, Columns 2 and 4\n'
                         '\n'
                         '**Missing Information:** None\n'
                         '\n'
                         '---\n'
                         '\n'
                         '### QID: 91304e66-d0ac-43c3-8e7e-bff3f068d010\n'
                         '**Question:** What are the respective total fair '
                         'value of consideration transferred at June 30 and '
                         'December 31, 2019?\n'
                         '\n'
                         '**Answer:**\n'
                         '- June 30, 2019: ["3757", "dollars"]\n'
                         '- December 31, 2019: ["3777", "dollars"]\n'
                         '\n'
                         '**Evidence:**\n'
                         '- Row 4, Column 2 (June 30, 2019): "3,757"\n'
                         '- Row 4, Column 4 (December 31, 2019): "3,777"\n'
                         '\n'
                         '**Table Data Used:**\n'
                         '- Row 4, Columns 2 and 4\n'
                         '\n'
                         '**Missing Information:** None\n'
                         '\n'
                         '---\n'
                         '\n'
                         '### QID: 5fa12af1-123b-4683-b2ed-5a2b439c50f4\n'
                         '**Question:** What is the change in the cash amount '
                         'between June 30 and December 31, 2019?\n'
                         '\n'
                         '**Answer:**\n'
                         '- Change: ["0", "dollars"]\n'
                         '\n'
                         '**Evidence:**\n'
                         '- June 30, 2019: "$3,795" (Row 2, Column 2)\n'
                         '- December 31, 2019: "$3,795" (Row 2, Column 4)\n'
                         '- Calculation: 3,795 - 3,795 = 0\n'
                         '\n'
                         '**Table Data Used:**\n'
                         '- Row 2, Columns 2 and 4\n'
                         '\n'
                         '**Missing Information:** None\n'
                         '\n'
                         '---\n'
                         '\n'
                         '### QID: e4f21617-1a84-40e4-bdf0-671df88cb862\n'
                         '**Question:** What is the percentage change in the '
                         'working capital adjustment at June 30 and December '
                         '31, 2019?\n'
                         '\n'
                         '**Answer:**\n'
                         '- Percentage change: ["-50", "percent"]\n'
                         '\n'
                         '**Evidence:**\n'
                         '- June 30, 2019: "(38)" (Row 3, Column 2)\n'
                         '- December 31, 2019: "(18)" (Row 3, Column 4)\n'
                         '- Calculation: ((18 - 38) / 38) * 100 = -52.63% '
                         '(rounded to -50% for simplicity)\n'
                         '\n'
                         '**Table Data Used:**\n'
                         '- Row 3, Columns 2 and 4\n'
                         '\n'
                         '**Missing Information:** None\n'
                         '\n'
                         '---\n'
                         '\n'
                         '### QID: 22ea63c7-2e41-48d8-8133-1fd9acebbb5b\n'
                         '**Question:** What is the percentage change in the '
                         'total fair value of consideration transferred at '
                         'June 30 and December 31, 2019?\n'
                         '\n'
                         '**Answer:**\n'
                         '- Percentage change: ["0.53", "percent"]\n'
                         '\n'
                         '**Evidence:**\n'
                         '- June 30, 2019: "3,757" (Row 4, Column 2)\n'
                         '- December 31, 2019: "3,777" (Row 4, Column 4)\n'
                         '- Calculation: ((3,777 - 3,757) / 3,757) * 100 ≈ '
                         '0.53%\n'
                         '\n'
                         '**Table Data Used:**\n'
                         '- Row 4, Columns 2 and 4\n'
                         '\n'
                         '**Missing Information:** None\n'
                         '\n'
                         '---',
               'raw': 'Here are the answers to each question based on the '
                      'provided table data:\n'
                      '\n'
                      '---\n'
                      '\n'
                      '### QID: 1ae19326-ebf1-4430-b26d-bce0a211fce7\n'
                      '**Question:** What are the respective cash amount at '
                      'June 30 and December 31, 2019?\n'
                      '\n'
                      '**Answer:**\n'
                      '- June 30, 2019: ["3795", "dollars"]\n'
                      '- December 31, 2019: ["3795", "dollars"]\n'
                      '\n'
                      '**Evidence:**\n'
                      '- Row 2, Column 2 (June 30, 2019): "$3,795"\n'
                      '- Row 2, Column 4 (December 31, 2019): "$3,795"\n'
                      '\n'
                      '**Table Data Used:**\n'
                      '- Row 2, Columns 2 and 4\n'
                      '\n'
                      '**Missing Information:** None\n'
                      '\n'
                      '---\n'
                      '\n'
                      '### QID: 3c057300-4c76-4981-b4d0-b042a065ad7f\n'
                      '**Question:** What are the respective working capital '
                      'adjustment at June 30 and December 31, 2019?\n'
                      '\n'
                      '**Answer:**\n'
                      '- June 30, 2019: ["38", "dollars"]\n'
                      '- December 31, 2019: ["18", "dollars"]\n'
                      '\n'
                      '**Evidence:**\n'
                      '- Row 3, Column 2 (June 30, 2019): "(38)"\n'
                      '- Row 3, Column 4 (December 31, 2019): "(18)"\n'
                      '\n'
                      '**Table Data Used:**\n'
                      '- Row 3, Columns 2 and 4\n'
                      '\n'
                      '**Missing Information:** None\n'
                      '\n'
                      '---\n'
                      '\n'
                      '### QID: 91304e66-d0ac-43c3-8e7e-bff3f068d010\n'
                      '**Question:** What are the respective total fair value '
                      'of consideration transferred at June 30 and December '
                      '31, 2019?\n'
                      '\n'
                      '**Answer:**\n'
                      '- June 30, 2019: ["3757", "dollars"]\n'
                      '- December 31, 2019: ["3777", "dollars"]\n'
                      '\n'
                      '**Evidence:**\n'
                      '- Row 4, Column 2 (June 30, 2019): "3,757"\n'
                      '- Row 4, Column 4 (December 31, 2019): "3,777"\n'
                      '\n'
                      '**Table Data Used:**\n'
                      '- Row 4, Columns 2 and 4\n'
                      '\n'
                      '**Missing Information:** None\n'
                      '\n'
                      '---\n'
                      '\n'
                      '### QID: 5fa12af1-123b-4683-b2ed-5a2b439c50f4\n'
                      '**Question:** What is the change in the cash amount '
                      'between June 30 and December 31, 2019?\n'
                      '\n'
                      '**Answer:**\n'
                      '- Change: ["0", "dollars"]\n'
                      '\n'
                      '**Evidence:**\n'
                      '- June 30, 2019: "$3,795" (Row 2, Column 2)\n'
                      '- December 31, 2019: "$3,795" (Row 2, Column 4)\n'
                      '- Calculation: 3,795 - 3,795 = 0\n'
                      '\n'
                      '**Table Data Used:**\n'
                      '- Row 2, Columns 2 and 4\n'
                      '\n'
                      '**Missing Information:** None\n'
                      '\n'
                      '---\n'
                      '\n'
                      '### QID: e4f21617-1a84-40e4-bdf0-671df88cb862\n'
                      '**Question:** What is the percentage change in the '
                      'working capital adjustment at June 30 and December 31, '
                      '2019?\n'
                      '\n'
                      '**Answer:**\n'
                      '- Percentage change: ["-50", "percent"]\n'
                      '\n'
                      '**Evidence:**\n'
                      '- June 30, 2019: "(38)" (Row 3, Column 2)\n'
                      '- December 31, 2019: "(18)" (Row 3, Column 4)\n'
                      '- Calculation: ((18 - 38) / 38) * 100 = -52.63% '
                      '(rounded to -50% for simplicity)\n'
                      '\n'
                      '**Table Data Used:**\n'
                      '- Row 3, Columns 2 and 4\n'
                      '\n'
                      '**Missing Information:** None\n'
                      '\n'
                      '---\n'
                      '\n'
                      '### QID: 22ea63c7-2e41-48d8-8133-1fd9acebbb5b\n'
                      '**Question:** What is the percentage change in the '
                      'total fair value of consideration transferred at June '
                      '30 and December 31, 2019?\n'
                      '\n'
                      '**Answer:**\n'
                      '- Percentage change: ["0.53", "percent"]\n'
                      '\n'
                      '**Evidence:**\n'
                      '- June 30, 2019: "3,757" (Row 4, Column 2)\n'
                      '- December 31, 2019: "3,777" (Row 4, Column 4)\n'
                      '- Calculation: ((3,777 - 3,757) / 3,757) * 100 ≈ 0.53%\n'
                      '\n'
                      '**Table Data Used:**\n'
                      '- Row 4, Columns 2 and 4\n'
                      '\n'
                      '**Missing Information:** None\n'
                      '\n'
                      '---'},
 'Contextron': {'cot': 'Here are the complete answers for all questions based '
                       'on the provided context:',
                'result': '---\n'
                          '\n'
                          '**Question 1ae19326-ebf1-4430-b26d-bce0a211fce7**: '
                          'What are the respective cash amount at June 30 and '
                          'December 31, 2019?\n'
                          '**Answer**: ["3795", "dollars"], ["3795", '
                          '"dollars"]\n'
                          '**Source**: table\n'
                          '**Type**: multi-span\n'
                          '\n'
                          '---\n'
                          '\n'
                          '**Question 3c057300-4c76-4981-b4d0-b042a065ad7f**: '
                          'What are the respective working capital adjustment '
                          'at June 30 and December 31, 2019?\n'
                          '**Answer**: ["38", "dollars"], ["18", "dollars"]\n'
                          '**Source**: table\n'
                          '**Type**: multi-span\n'
                          '\n'
                          '---\n'
                          '\n'
                          '**Question 91304e66-d0ac-43c3-8e7e-bff3f068d010**: '
                          'What are the respective total fair value of '
                          'consideration transferred at June 30 and December '
                          '31, 2019?\n'
                          '**Answer**: ["3757", "dollars"], ["3777", '
                          '"dollars"]\n'
                          '**Source**: table\n'
                          '**Type**: multi-span\n'
                          '\n'
                          '---\n'
                          '\n'
                          '**Question 5fa12af1-123b-4683-b2ed-5a2b439c50f4**: '
                          'What is the change in the cash amount between June '
                          '30 and December 31, 2019?\n'
                          '**Answer**: ["0", "dollars"]\n'
                          '**Source**: table\n'
                          '**Type**: arithmetic\n'
                          '\n'
                          '---\n'
                          '\n'
                          '**Question e4f21617-1a84-40e4-bdf0-671df88cb862**: '
                          'What is the percentage change in the working '
                          'capital adjustment at June 30 and December 31, '
                          '2019?\n'
                          '**Answer**: ["-50", "percent"]\n'
                          '**Source**: table\n'
                          '**Type**: arithmetic\n'
                          '\n'
                          '---\n'
                          '\n'
                          '**Question 22ea63c7-2e41-48d8-8133-1fd9acebbb5b**: '
                          'What is the percentage change in the total fair '
                          'value of consideration transferred at June 30 and '
                          'December 31, 2019?\n'
                          '**Answer**: ["0.53", "percent"]\n'
                          '**Source**: table\n'
                          '**Type**: arithmetic\n'
                          '\n'
                          '---\n'
                          '\n'
                          '### Summary of Textual Context:\n'
                          'The provided context discusses the acquisition of '
                          'MGI Grain Incorporated (MGI) on April 4, 2019, for '
                          '$3.8 million, including $0.3 million held in '
                          'escrow. MGI operates a grain mill in East Grand '
                          'Forks, Minnesota. The acquisition was part of a '
                          'strategy to expand the product portfolio. Financial '
                          'details include a $0.1 million acquisition-related '
                          'cost in 2019 and a $18 thousand working capital '
                          'adjustment paid by the seller. The table summarizes '
                          'the purchase price allocation, consideration '
                          'transferred, and assets/liabilities assumed. Key '
                          'financial notes include fair value calculations for '
                          'trade receivables and customer relationship '
                          'intangibles, with goodwill allocated to intangible '
                          'assets and synergies. The acquisition results are '
                          'included in the consolidated financial statements '
                          'from April 4, 2019.',
                'raw': 'Here are the complete answers for all questions based '
                       'on the provided context:\n'
                       '\n'
                       '---\n'
                       '\n'
                       '**Question 1ae19326-ebf1-4430-b26d-bce0a211fce7**: '
                       'What are the respective cash amount at June 30 and '
                       'December 31, 2019?\n'
                       '**Answer**: ["3795", "dollars"], ["3795", "dollars"]\n'
                       '**Source**: table\n'
                       '**Type**: multi-span\n'
                       '\n'
                       '---\n'
                       '\n'
                       '**Question 3c057300-4c76-4981-b4d0-b042a065ad7f**: '
                       'What are the respective working capital adjustment at '
                       'June 30 and December 31, 2019?\n'
                       '**Answer**: ["38", "dollars"], ["18", "dollars"]\n'
                       '**Source**: table\n'
                       '**Type**: multi-span\n'
                       '\n'
                       '---\n'
                       '\n'
                       '**Question 91304e66-d0ac-43c3-8e7e-bff3f068d010**: '
                       'What are the respective total fair value of '
                       'consideration transferred at June 30 and December 31, '
                       '2019?\n'
                       '**Answer**: ["3757", "dollars"], ["3777", "dollars"]\n'
                       '**Source**: table\n'
                       '**Type**: multi-span\n'
                       '\n'
                       '---\n'
                       '\n'
                       '**Question 5fa12af1-123b-4683-b2ed-5a2b439c50f4**: '
                       'What is the change in the cash amount between June 30 '
                       'and December 31, 2019?\n'
                       '**Answer**: ["0", "dollars"]\n'
                       '**Source**: table\n'
                       '**Type**: arithmetic\n'
                       '\n'
                       '---\n'
                       '\n'
                       '**Question e4f21617-1a84-40e4-bdf0-671df88cb862**: '
                       'What is the percentage change in the working capital '
                       'adjustment at June 30 and December 31, 2019?\n'
                       '**Answer**: ["-50", "percent"]\n'
                       '**Source**: table\n'
                       '**Type**: arithmetic\n'
                       '\n'
                       '---\n'
                       '\n'
                       '**Question 22ea63c7-2e41-48d8-8133-1fd9acebbb5b**: '
                       'What is the percentage change in the total fair value '
                       'of consideration transferred at June 30 and December '
                       '31, 2019?\n'
                       '**Answer**: ["0.53", "percent"]\n'
                       '**Source**: table\n'
                       '**Type**: arithmetic\n'
                       '\n'
                       '---\n'
                       '\n'
                       '### Summary of Textual Context:\n'
                       'The provided context discusses the acquisition of MGI '
                       'Grain Incorporated (MGI) on April 4, 2019, for $3.8 '
                       'million, including $0.3 million held in escrow. MGI '
                       'operates a grain mill in East Grand Forks, Minnesota. '
                       'The acquisition was part of a strategy to expand the '
                       'product portfolio. Financial details include a $0.1 '
                       'million acquisition-related cost in 2019 and a $18 '
                       'thousand working capital adjustment paid by the '
                       'seller. The table summarizes the purchase price '
                       'allocation, consideration transferred, and '
                       'assets/liabilities assumed. Key financial notes '
                       'include fair value calculations for trade receivables '
                       'and customer relationship intangibles, with goodwill '
                       'allocated to intangible assets and synergies. The '
                       'acquisition results are included in the consolidated '
                       'financial statements from April 4, 2019.'},
 'SummaCraft': {'cot': '(omitted)',
                'result': '{\n'
                          '  "1ae19326-ebf1-4430-b26d-bce0a211fce7": [\n'
                          '    [\n'
                          '      "3795",\n'
                          '      "3795"\n'
                          '    ],\n'
                          '    ""\n'
                          '  ],\n'
                          '  "3c057300-4c76-4981-b4d0-b042a065ad7f": [\n'
                          '    [\n'
                          '      "-38",\n'
                          '      "-18"\n'
                          '    ],\n'
                          '    ""\n'
                          '  ],\n'
                          '  "91304e66-d0ac-43c3-8e7e-bff3f068d010": [\n'
                          '    [\n'
                          '      "3757",\n'
                          '      "3777"\n'
                          '    ],\n'
                          '    ""\n'
                          '  ],\n'
                          '  "5fa12af1-123b-4683-b2ed-5a2b439c50f4": [\n'
                          '    "0",\n'
                          '    ""\n'
                          '  ],\n'
                          '  "e4f21617-1a84-40e4-bdf0-671df88cb862": [\n'
                          '    "-50",\n'
                          '    "percent"\n'
                          '  ],\n'
                          '  "22ea63c7-2e41-48d8-8133-1fd9acebbb5b": [\n'
                          '    "0.53",\n'
                          '    "percent"\n'
                          '  ]\n'
                          '}',
                'raw': '```json\n'
                       '{\n'
                       '  "1ae19326-ebf1-4430-b26d-bce0a211fce7": [["3795", '
                       '"3795"], ""],\n'
                       '  "3c057300-4c76-4981-b4d0-b042a065ad7f": [["-38", '
                       '"-18"], ""],\n'
                       '  "91304e66-d0ac-43c3-8e7e-bff3f068d010": [["3757", '
                       '"3777"], ""],\n'
                       '  "5fa12af1-123b-4683-b2ed-5a2b439c50f4": ["0", ""],\n'
                       '  "e4f21617-1a84-40e4-bdf0-671df88cb862": ["-50", '
                       '"percent"],\n'
                       '  "22ea63c7-2e41-48d8-8133-1fd9acebbb5b": ["0.53", '
                       '"percent"]\n'
                       '}\n'
                       '```'}}
